{
  "type": "evidence_instance",
  "id": "instance.delivery-note",
  "entityRef": "evidence.delivery-note",
  "values": {
    "created_at": "2026-11-06T09:00:00Z",
    "delivery_note_number": "DN-001",
    "request_number": "DELIVERY-REQ-001",
    "delivery_address": "甲方仓库"
  },
  "basedOn": ["instance.delivery-request"]
}
