{
  "type": "evidence_instance",
  "id": "instance.content-prepaid",
  "entityRef": "confirmation.access",
  "values": {
    "subscription_id": "SUB-20261001-001",
    "reader_id": "READER-001",
    "column_id": "COL-BM",
    "request_id": "ACCESS-PREPAID",
    "chapter_id": "CH-01",
    "edition_id": "ED-1",
    "confirmed_at": "2026-10-01T09:06:02Z",
    "delivered": true
  },
  "basedOn": ["instance.access-prepaid"]
}
