{
  "type": "evidence_instance",
  "id": "instance.payment-confirmation",
  "entityRef": "confirmation.payment",
  "values": {
    "confirmed_at": "2026-11-04T10:05:00Z",
    "paid_minor_units": 250000,
    "request_number": "PAYMENT-REQ-001",
    "payment_number": "WX-001"
  },
  "basedOn": [
    "instance.payment-request",
    "instance.wechat-payment-confirmation"
  ]
}
